<?xml version="1.0" encoding="UTF-8"?>
<xs:schema xmlns:xs="http://www.w3.org/2001/XMLSchema" elementFormDefault="qualified"> 
    <xs:element name="genres">
        <xs:complexType>
            <xs:sequence>
                <xs:element name="genre" minOccurs="1" maxOccurs="unbounded">
                    <xs:complexType>
                        <xs:sequence>
                            <xs:element name="genre_titel" type="xs:string" minOccurs="1" maxOccurs="1"/>
                            <xs:element name="genre_beschreibung" type="xs:string" minOccurs="1" maxOccurs="1"/>
                        </xs:sequence>
                        <xs:attribute name="genre_id" type="xs:ID" use="required"/>
                    </xs:complexType>
                </xs:element>
            </xs:sequence>
        </xs:complexType>
    </xs:element>
</xs:schema>
